[
  {
    "id": "lipsurf",
    "name": "LipSurf",
    "category": "Voice and sound",
    "url": "https://www.lipsurf.com/",
    "summary": "Navigate browser pages, dictate text, and invoke commands using a microphone and a Chrome extension.",
    "summary_zh": "用麦克风和 Chrome 扩展浏览网页、输入文本并执行命令。",
    "outcome": "Voice-operated browsing",
    "outcome_zh": "语音浏览网页",
    "devices": [
      "Chrome on Windows, macOS, Linux or Chromebook"
    ],
    "requirements": [
      "Microphone",
      "LipSurf extension",
      "Free daily allowance; paid unlimited plan"
    ],
    "status": "released",
    "evidence_url": "https://www.lipsurf.com/",
    "evidence_note": "Developer describes supported platforms and voice commands.",
    "checked_at": "2026-10-26",
    "limitations": [
      "Controls supported browser workflows.",
      "Free plan limits daily commands."
    ],
    "steps": [
      "Install the extension.",
      "Allow microphone access.",
      "Use its command help to navigate."
    ]
  },
  {
    "id": "mac-vocal-shortcuts",
    "name": "macOS Vocal Shortcuts",
    "category": "Voice and sound",
    "url": "https://support.apple.com/en-euro/guide/mac-help/mchlf4548bb6/27/mac/27",
    "summary": "Associate a trained word or custom sound with a chosen Mac action.",
    "summary_zh": "把训练过的词语或自定义声音关联到指定的 Mac 操作。",
    "outcome": "Personal sound shortcuts",
    "outcome_zh": "个人声音快捷指令",
    "devices": [
      "Apple silicon Mac"
    ],
    "requirements": [
      "Microphone"
    ],
    "status": "released",
    "evidence_url": "https://support.apple.com/en-euro/guide/mac-help/mchlf4548bb6/27/mac/27",
    "evidence_note": "Apple describes custom utterances and on-device recognition.",
    "checked_at": "2026-10-26",
    "limitations": [
      "Requires Apple silicon.",
      "Each utterance needs training."
    ],
    "steps": [
      "Open Accessibility → Vocal Shortcuts.",
      "Choose an action.",
      "Repeat the chosen utterance during setup."
    ]
  },
  {
    "id": "mac-voice-control",
    "name": "macOS Voice Control",
    "category": "Voice and sound",
    "url": "https://support.apple.com/en-ie/guide/mac-help/mh40719/27/mac/27",
    "summary": "Use spoken commands to open apps, click controls, scroll pages, and dictate text on a Mac.",
    "summary_zh": "通过口述命令在 Mac 上打开应用、点击控件、滚动页面和输入文字。",
    "outcome": "Navigate a Mac by voice",
    "outcome_zh": "语音操作 Mac",
    "devices": [
      "Mac"
    ],
    "requirements": [
      "Microphone",
      "Supported recognition language"
    ],
    "status": "released",
    "evidence_url": "https://support.apple.com/en-ie/guide/mac-help/mh40719/27/mac/27",
    "evidence_note": "Apple documents commands and the built-in tutorial.",
    "checked_at": "2026-10-26",
    "limitations": [
      "Standard Dictation is unavailable while Voice Control runs."
    ],
    "steps": [
      "Enable Voice Control in Accessibility settings.",
      "Open its tutorial.",
      "Use Show Commands to discover actions."
    ]
  },
  {
    "id": "parrot-py",
    "name": "Parrot.py",
    "category": "Voice and sound",
    "url": "https://github.com/chaosparrot/parrot.py",
    "summary": "Train personally chosen clicks, chirps, or other non-speech sounds to trigger keyboard and mouse actions.",
    "summary_zh": "训练自己选择的点击声、啾声等非语音声音，用来触发键盘和鼠标操作。",
    "outcome": "Custom sound controls",
    "outcome_zh": "自定义声音控制",
    "devices": [
      "Windows",
      "macOS",
      "Linux X11"
    ],
    "requirements": [
      "Microphone",
      "64-bit Python 3.8"
    ],
    "status": "research",
    "evidence_url": "https://github.com/chaosparrot/parrot.py",
    "evidence_note": "README documents recording, training and playback.",
    "checked_at": "2026-10-26",
    "limitations": [
      "Prototype; training required.",
      "Gaze control requires separate software."
    ],
    "steps": [
      "Record labeled sounds.",
      "Train and inspect the model.",
      "Configure actions and run play.py."
    ]
  },
  {
    "id": "talon",
    "name": "Talon",
    "category": "Voice and sound",
    "url": "https://talonvoice.com/",
    "summary": "Operate desktop software through spoken commands and short mouth sounds; optionally combine them with gaze pointing.",
    "summary_zh": "用语音命令和简短口腔声音操作桌面软件，也可配合眼动指针。",
    "outcome": "Hands-free desktop commands",
    "outcome_zh": "免手操作桌面",
    "devices": [
      "Windows",
      "macOS",
      "Linux X11"
    ],
    "requirements": [
      "Microphone",
      "Compatible command set",
      "Free speech engine; optional paid Talon+"
    ],
    "status": "released",
    "evidence_url": "https://talonvoice.com/docs/reference/official.html",
    "evidence_note": "Official installation and input documentation.",
    "checked_at": "2026-10-26",
    "limitations": [
      "Linux Wayland unsupported.",
      "Eye pointing needs compatible tracking hardware."
    ],
    "steps": [
      "Install Talon.",
      "Configure speech recognition and commands.",
      "Practice commands or sound actions."
    ],
    "spotlight": true
  },
  {
    "id": "voiceattack",
    "name": "VoiceAttack",
    "category": "Voice and sound",
    "url": "https://www.voiceattack.com/",
    "summary": "Turn spoken phrases into game controls, application shortcuts, and multi-step macros.",
    "summary_zh": "把口述短语变成游戏控制、应用快捷键和多步骤宏。",
    "outcome": "Speak a command sequence",
    "outcome_zh": "语音执行一串操作",
    "devices": [
      "Windows"
    ],
    "requirements": [
      "Microphone",
      "Paid registration beyond the limited free trial"
    ],
    "status": "released",
    "evidence_url": "https://www.voiceattack.com/VoiceAttackHelpV2.pdf",
    "evidence_note": "Developer manual describes profiles and command actions.",
    "checked_at": "2026-10-26",
    "limitations": [
      "Trial limits profiles and commands.",
      "Macros require configuration."
    ],
    "steps": [
      "Install and select the microphone.",
      "Create a phrase with actions.",
      "Test the command in its target application."
    ]
  },
  {
    "id": "windows-voice-access",
    "name": "Windows Voice Access",
    "category": "Voice and sound",
    "url": "https://support.microsoft.com/en-us/accessibility/windows/voice-access/get-started-with-voice-access",
    "summary": "Control Windows and compose text with speech recognition that runs locally after its language model is downloaded.",
    "summary_zh": "下载语言模型后，通过本地语音识别控制 Windows 和输入文字。",
    "outcome": "Offline voice control",
    "outcome_zh": "离线语音控制",
    "devices": [
      "Windows 11 22H2 or later"
    ],
    "requirements": [
      "Microphone",
      "Initial language-model download"
    ],
    "status": "released",
    "evidence_url": "https://support.microsoft.com/en-us/accessibility/windows/voice-access/get-started-with-voice-access",
    "evidence_note": "Microsoft documents setup and the interactive guide.",
    "checked_at": "2026-10-26",
    "limitations": [
      "Supported languages vary.",
      "Initial setup needs internet."
    ],
    "steps": [
      "Enable Voice Access in Accessibility settings.",
      "Download the language and configure microphone.",
      "Complete the interactive guide."
    ]
  },
  {
    "id": "android-camera-switches",
    "name": "Android Camera Switches",
    "category": "Eyes and face",
    "url": "https://support.google.com/accessibility/android/answer/11150722?hl=en",
    "summary": "Map facial gestures to scanning and selection actions, using a phone's front camera as switch input.",
    "summary_zh": "把面部动作映射为扫描和选择操作，将手机前置摄像头用作开关输入。",
    "outcome": "Face gestures select controls",
    "outcome_zh": "面部动作选择控件",
    "devices": [
      "Compatible Android device"
    ],
    "requirements": [
      "Front camera",
      "Switch Access"
    ],
    "status": "released",
    "evidence_url": "https://support.google.com/accessibility/android/answer/11150722?hl=en",
    "evidence_note": "Google documents gesture assignments and setup.",
    "checked_at": "2026-10-26",
    "limitations": [
      "Cannot operate alongside other camera apps.",
      "Initial setup may require assistance."
    ],
    "steps": [
      "Open Switch Access setup.",
      "Choose Camera Switch and assign gestures.",
      "Adjust gesture size and hold time."
    ]
  },
  {
    "id": "eyegestures",
    "name": "EyeGestures Demo",
    "category": "Eyes and face",
    "url": "https://github.com/NativeSensors/EyeGestures",
    "summary": "Run a webcam gaze-calibration example as a starting point for a custom gaze interface.",
    "summary_zh": "运行基于摄像头的视线校准示例，作为开发自定义眼动界面的起点。",
    "outcome": "Prototype gaze input",
    "outcome_zh": "制作眼动输入原型",
    "devices": [
      "Python-capable computer"
    ],
    "requirements": [
      "Webcam",
      "Python dependencies"
    ],
    "status": "source-build",
    "evidence_url": "https://github.com/NativeSensors/EyeGestures",
    "evidence_note": "README documents package installation and example execution.",
    "checked_at": "2026-10-26",
    "limitations": [
      "Developer integration required.",
      "Dependency installation may need adjustment."
    ],
    "steps": [
      "Install eyeGestures and obtain examples.",
      "Run examples/simple_example_v4.py.",
      "Calibrate at the documented viewing distance."
    ]
  },
  {
    "id": "eyeharp",
    "name": "EyeHarp",
    "category": "Eyes and face",
    "url": "https://eyeharp.org/",
    "summary": "Play a musical instrument by selecting notes with gaze; head tracking or another pointer can also control it.",
    "summary_zh": "通过目光选择音符来演奏乐器，也可使用头部追踪或其他指针设备。",
    "outcome": "Perform music with gaze",
    "outcome_zh": "用眼动演奏音乐",
    "devices": [
      "Windows"
    ],
    "requirements": [
      "Separate Tobii eye tracker for gaze",
      "Registration and license key",
      "Free basic piano; paid full edition"
    ],
    "status": "released",
    "evidence_url": "https://eyeharp.org/faq/",